<?xml version="1.0"?>
<coupling:coupling xmlns:xsi="http://www.w3.org/2001/XMLSchema-instance" xsi:schemaLocation="XMLCoupling ../xsd/coupling_xml.xsd" xmlns:coupling="XMLCoupling">
    <coupling:general id="heat-elasticity" name="Thermoelasticity">
        <coupling:description>Heat plus elasticity</coupling:description>
        <coupling:modules>
            <coupling:source id="heat" />
            <coupling:target id="elasticity" />
        </coupling:modules>
    </coupling:general>

    <coupling:constants />

    <coupling:volume>
        <coupling:vector_form id="weak_1_1" i="1" j="1" planar="((3*(st_E * st_nu) / ((1.0 + st_nu) * (1.0 - 2.0*st_nu)) + 2*st_E / (2.0*(1.0 + st_nu))) * st_alpha * (source1 - st_Tr)) * vdx" axi="r * ((3*(st_E * st_nu) / ((1.0 + st_nu) * (1.0 - 2.0*st_nu)) + 2*st_E / (2.0*(1.0 + st_nu))) * st_alpha * (source1 - st_Tr)) * (vdr + vval / r)"/>
        <coupling:vector_form id="weak_2_2" i="2" j="2" planar="((3*(st_E * st_nu) / ((1.0 + st_nu) * (1.0 - 2.0*st_nu)) + 2*st_E / (2.0*(1.0 + st_nu))) * st_alpha * (source1 - st_Tr)) * vdy" axi="r * ((3*(st_E * st_nu) / ((1.0 + st_nu) * (1.0 - 2.0*st_nu)) + 2*st_E / (2.0*(1.0 + st_nu))) * st_alpha * (source1 - st_Tr)) * vdz"/>
        <coupling:matrix_form id="hard_matrix_2_1" i="2" j="1" planar="- ((3*(st_E * st_nu) / ((1.0 + st_nu) * (1.0 - 2.0*st_nu)) + 2*st_E / (2.0*(1.0 + st_nu))) * st_alpha * uval) * vdx" axi="- r * ((3*(st_E * st_nu) / ((1.0 + st_nu) * (1.0 - 2.0*st_nu)) + 2*st_E / (2.0*(1.0 + st_nu))) * st_alpha * uval) * (vdr + vval / r)"/>
        <coupling:matrix_form id="hard_matrix_3_1" i="3" j="1" planar="- ((3*(st_E * st_nu) / ((1.0 + st_nu) * (1.0 - 2.0*st_nu)) + 2*st_E / (2.0*(1.0 + st_nu))) * st_alpha * uval) * vdy" axi="- r * ((3*(st_E * st_nu) / ((1.0 + st_nu) * (1.0 - 2.0*st_nu)) + 2*st_E / (2.0*(1.0 + st_nu))) * st_alpha * uval) * vdz"/>
        <coupling:vector_form id="hard_vector_linear_2_1" i="2" j="1" planar="- ((3*(st_E * st_nu) / ((1.0 + st_nu) * (1.0 - 2.0*st_nu)) + 2*st_E / (2.0*(1.0 + st_nu))) * st_alpha * st_Tr) * vdx" axi="- r * ((3*(st_E * st_nu) / ((1.0 + st_nu) * (1.0 - 2.0*st_nu)) + 2*st_E / (2.0*(1.0 + st_nu))) * st_alpha * st_Tr) * (vdr + vval / r)"/>
        <coupling:vector_form id="hard_vector_linear_3_1" i="3" j="1" planar="- ((3*(st_E * st_nu) / ((1.0 + st_nu) * (1.0 - 2.0*st_nu)) + 2*st_E / (2.0*(1.0 + st_nu))) * st_alpha * st_Tr) * vdy" axi="- r * ((3*(st_E * st_nu) / ((1.0 + st_nu) * (1.0 - 2.0*st_nu)) + 2*st_E / (2.0*(1.0 + st_nu))) * st_alpha * st_Tr) * vdz"/>
        <coupling:vector_form id="hard_vector_newton_2_1" i="2" j="1" planar="- ((3*(st_E * st_nu) / ((1.0 + st_nu) * (1.0 - 2.0*st_nu)) + 2*st_E / (2.0*(1.0 + st_nu))) * st_alpha * (upval - st_Tr)) * vdx" axi="- r * ((3*(st_E * st_nu) / ((1.0 + st_nu) * (1.0 - 2.0*st_nu)) + 2*st_E / (2.0*(1.0 + st_nu))) * st_alpha * (upval - st_Tr)) * (vdr + vval / r)" />
        <coupling:vector_form id="hard_vector_newton_3_1" i="3" j="1" planar="- ((3*(st_E * st_nu) / ((1.0 + st_nu) * (1.0 - 2.0*st_nu)) + 2*st_E / (2.0*(1.0 + st_nu))) * st_alpha * (upval - st_Tr)) * vdy" axi="- r * ((3*(st_E * st_nu) / ((1.0 + st_nu) * (1.0 - 2.0*st_nu)) + 2*st_E / (2.0*(1.0 + st_nu))) * st_alpha * (upval - st_Tr)) * vdz" />

        <coupling:weakforms_volume>
            <coupling:weakform_volume couplingtype="weak" sourceanalysis="steadystate" targetanalysis="steadystate" equation="">
                <coupling:linearity_option type="linear">
                    <coupling:vector_form id="weak_1_1" />
                    <coupling:vector_form id="weak_2_2" />
                </coupling:linearity_option>

                <coupling:linearity_option type="newton">
                    <coupling:vector_form id="weak_1_1" coefficient="-1"/>
                    <coupling:vector_form id="weak_2_2" coefficient="-1"/>
                </coupling:linearity_option>

            </coupling:weakform_volume>

            <coupling:weakform_volume couplingtype="hard" sourceanalysis="steadystate" targetanalysis="steadystate" equation="">
                <coupling:linearity_option type="linear">
                    <coupling:matrix_form id="hard_matrix_2_1" />
                    <coupling:matrix_form id="hard_matrix_3_1" />
                    <coupling:vector_form id="hard_vector_linear_2_1" />
                    <coupling:vector_form id="hard_vector_linear_3_1" />
                </coupling:linearity_option>

                <coupling:linearity_option type="newton">
                    <coupling:matrix_form id="hard_matrix_2_1" />
                    <coupling:matrix_form id="hard_matrix_3_1" />
                    <coupling:vector_form id="hard_vector_newton_2_1" />
                    <coupling:vector_form id="hard_vector_newton_3_1" />
                </coupling:linearity_option>

            </coupling:weakform_volume>

            <coupling:weakform_volume couplingtype="weak" sourceanalysis="transient" targetanalysis="steadystate" equation="">
                <coupling:linearity_option type="linear">
                    <coupling:vector_form id="weak_1_1" />
                    <coupling:vector_form id="weak_2_2" />
                </coupling:linearity_option>

                <coupling:linearity_option type="newton">
                    <coupling:vector_form id="weak_1_1" coefficient="-1"/>
                    <coupling:vector_form id="weak_2_2" coefficient="-1"/>
                </coupling:linearity_option>

            </coupling:weakform_volume>

            <coupling:weakform_volume couplingtype="hard" sourceanalysis="transient" targetanalysis="steadystate" equation="">
                <coupling:linearity_option type="linear">
                    <coupling:matrix_form id="hard_matrix_2_1" />
                    <coupling:matrix_form id="hard_matrix_3_1" />
                    <coupling:vector_form id="hard_vector_linear_2_1" />
                    <coupling:vector_form id="hard_vector_linear_3_1" />
                </coupling:linearity_option>

                <coupling:linearity_option type="newton">
                    <coupling:matrix_form id="hard_matrix_2_1" />
                    <coupling:matrix_form id="hard_matrix_3_1" />
                    <coupling:vector_form id="hard_vector_newton_2_1" />
                    <coupling:vector_form id="hard_vector_newton_3_1" />
                </coupling:linearity_option>

            </coupling:weakform_volume>

        </coupling:weakforms_volume>
    </coupling:volume>
</coupling:coupling>
